{
 "schema_version": "city-plan-v2",
 "city_id": "shymkent",
 "source_snapshot": "sha256:282cf187523d8b990ac9bfde69ba43763248aa9b49007149a094ccc81bd36ec2",
 "category": "outpatient_clinic",
 "control_points": [
  {
   "id": "cp01",
   "lon": 69.596402,
   "lat": 42.308891,
   "weight": 4
  },
  {
   "id": "cp02",
   "lon": 69.602475,
   "lat": 42.308891,
   "weight": 2
  },
  {
   "id": "cp03",
   "lon": 69.608548,
   "lat": 42.308891,
   "weight": 5
  },
  {
   "id": "cp04",
   "lon": 69.614621,
   "lat": 42.308891,
   "weight": 3
  },
  {
   "id": "cp05",
   "lon": 69.596402,
   "lat": 42.313382,
   "weight": 1
  },
  {
   "id": "cp06",
   "lon": 69.602475,
   "lat": 42.313382,
   "weight": 4
  },
  {
   "id": "cp07",
   "lon": 69.608548,
   "lat": 42.313382,
   "weight": 2
  },
  {
   "id": "cp08",
   "lon": 69.614621,
   "lat": 42.313382,
   "weight": 5
  },
  {
   "id": "cp09",
   "lon": 69.596402,
   "lat": 42.317874,
   "weight": 3
  },
  {
   "id": "cp10",
   "lon": 69.602475,
   "lat": 42.317874,
   "weight": 1
  },
  {
   "id": "cp11",
   "lon": 69.608548,
   "lat": 42.317874,
   "weight": 4
  },
  {
   "id": "cp12",
   "lon": 69.614621,
   "lat": 42.317874,
   "weight": 2
  },
  {
   "id": "cp13",
   "lon": 69.596402,
   "lat": 42.322365,
   "weight": 5
  },
  {
   "id": "cp14",
   "lon": 69.602475,
   "lat": 42.322365,
   "weight": 3
  },
  {
   "id": "cp15",
   "lon": 69.608548,
   "lat": 42.322365,
   "weight": 1
  },
  {
   "id": "cp16",
   "lon": 69.614621,
   "lat": 42.322365,
   "weight": 4
  }
 ],
 "candidates": [
  {
   "id": "c01",
   "lon": 69.596402,
   "lat": 42.309639,
   "category": "outpatient_clinic",
   "kind": "hypothetical",
   "cost": 350
  },
  {
   "id": "c02",
   "lon": 69.602475,
   "lat": 42.309639,
   "category": "outpatient_clinic",
   "kind": "hypothetical",
   "cost": 250
  },
  {
   "id": "c03",
   "lon": 69.608548,
   "lat": 42.309639,
   "category": "outpatient_clinic",
   "kind": "hypothetical",
   "cost": 150
  },
  {
   "id": "c04",
   "lon": 69.614621,
   "lat": 42.309639,
   "category": "outpatient_clinic",
   "kind": "hypothetical",
   "cost": 400
  },
  {
   "id": "c05",
   "lon": 69.596402,
   "lat": 42.315628,
   "category": "outpatient_clinic",
   "kind": "hypothetical",
   "cost": 300
  },
  {
   "id": "c06",
   "lon": 69.602475,
   "lat": 42.315628,
   "category": "outpatient_clinic",
   "kind": "hypothetical",
   "cost": 200
  },
  {
   "id": "c07",
   "lon": 69.608548,
   "lat": 42.315628,
   "category": "outpatient_clinic",
   "kind": "hypothetical",
   "cost": 100
  },
  {
   "id": "c08",
   "lon": 69.614621,
   "lat": 42.315628,
   "category": "outpatient_clinic",
   "kind": "hypothetical",
   "cost": 350
  },
  {
   "id": "c09",
   "lon": 69.596402,
   "lat": 42.321617,
   "category": "outpatient_clinic",
   "kind": "hypothetical",
   "cost": 250
  },
  {
   "id": "c10",
   "lon": 69.602475,
   "lat": 42.321617,
   "category": "outpatient_clinic",
   "kind": "hypothetical",
   "cost": 150
  },
  {
   "id": "c11",
   "lon": 69.608548,
   "lat": 42.321617,
   "category": "outpatient_clinic",
   "kind": "hypothetical",
   "cost": 400
  },
  {
   "id": "c12",
   "lon": 69.614621,
   "lat": 42.321617,
   "category": "outpatient_clinic",
   "kind": "hypothetical",
   "cost": 300
  }
 ],
 "budget": 700,
 "max_selected": 3,
 "coverage_radius_m": 400,
 "required_ids": [
  "c12"
 ],
 "excluded_ids": [
  "c02",
  "c03"
 ],
 "selected_ids": [
  "c06",
  "c07"
 ]
}
